<?xml version="1.0" encoding="UTF-8"?>

<!-- FCM transforms XML File -->
    <transforms:Transformation-ML 
        xmlns:xsi="http://www.w3.org/2001/XMLSchema-instance"
        xmlns:transforms="http://www.isac-net.org/std/Transformation-ML/v1.0/"
        xmlns:mml="http://www.w3.org/1998/Math/MathML"
        xsi:schemaLocation="
            http://www.isac-net.org/std/Transformation-ML/v1.0/  ../../Transformation-ML.v1.0/schema/Transformation-ML.v1.0.xsd
            http://www.w3.org/1998/Math/MathML ../../Transformation-ML.v1.0/mathml2/mathml2.xsd">
 
	<!-- Duplicate Name. Found at load time -->

    <transforms:transformation transforms:newName="CD24-FITC-530nm.t1">
        <transforms:pre-defined>
            <transforms:linear transforms:a="3.0" transforms:b="0" transforms:parameter="CD24-FITC-530nm"/>
        </transforms:pre-defined>
    </transforms:transformation>
    
    <transforms:transformation transforms:newName="Blah Blah Blah">
        <transforms:pre-defined>
            <transforms:log transforms:parameter="PE-565nm" transforms:d="4" transforms:r="10000"/>
        </transforms:pre-defined>
    </transforms:transformation>
    
    <transforms:transformation transforms:newName="CD24-FITC-530nm.t1">
        <transforms:pre-defined>
            <transforms:quadratic transforms:parameter="CD24-FITC-530nm.t1" transforms:a="1" transforms:b="1" transforms:c="0"/>
        </transforms:pre-defined>
    </transforms:transformation>
    
</transforms:Transformation-ML>
