<?xml version="1.0" encoding="UTF-8"?>

<!-- FCM transforms XML File -->
<transforms:Transformation-ML 
        xmlns:xsi="http://www.w3.org/2001/XMLSchema-instance"
        xmlns:transforms="http://www.isac-net.org/std/Transformation-ML/v1.0/"
        xmlns:mml="http://www.w3.org/1998/Math/MathML"
        xsi:schemaLocation="
            http://www.isac-net.org/std/Transformation-ML/v1.0/  ../../Transformation-ML.v1.0/schema/Transformation-ML.v1.0.xsd
            http://www.w3.org/1998/Math/MathML ../../Transformation-ML.v1.0/mathml2/mathml2.xsd">

	<transforms:transformation transforms:newName="linToLog FL1-H">
        <transforms:pre-defined>
            <transforms:log transforms:r="1" transforms:d="1" transforms:parameter="FL1-H"/>
        </transforms:pre-defined>
    </transforms:transformation>
    
    <transforms:transformation transforms:newName="linToLog FL2-H">
        <transforms:pre-defined>
            <transforms:log transforms:r="1" transforms:d="1" transforms:parameter="FL2-H"/>
        </transforms:pre-defined>
    </transforms:transformation>

    <transforms:transformation transforms:newName="linToLog FL3-H">
        <transforms:pre-defined>
            <transforms:log transforms:r="1" transforms:d="1" transforms:parameter="FL3-H"/>
        </transforms:pre-defined>
    </transforms:transformation>
    
</transforms:Transformation-ML>